{"$schema":"https://json-schema.org/draft/2020-12/schema","$id":"https://gwc.local/schemas/integrations/task-me-host-result.schema.json","type":"object","additionalProperties":false,"required":["schema_version","status","task_id","run_id","idempotency_key","owner_root","artifacts","blockers","dag_valid","artifact_id","parent_artifact_id","source_repo","source_ref","source_sha","tool_package","tool_source_commit","generated_at"],"properties":{"schema_version":{"type":"string"},"status":{"enum":["COMPLETE","PARTIAL","BLOCKED","INVALID_INPUT","TOOL_UNAVAILABLE"]},"task_id":{"const":"SCRUM-118"},"run_id":{"type":"string"},"idempotency_key":{"type":"string"},"owner_root":{"const":".task-me"},"artifacts":{"type":"array"},"blockers":{"type":"array"},"dag_valid":{"type":"boolean"},"artifact_id":{"type":"string"},"parent_artifact_id":{"type":["string","null"]},"source_repo":{"type":"string"},"source_ref":{"type":"string"},"source_sha":{"type":"string"},"tool_package":{"type":"string"},"tool_source_commit":{"type":"string"},"generated_at":{"type":"string"}}}
