{"schema_version":"1.0","status":"COMPLETE","task_id":"SCRUM-118","run_id":"gwc-scrum-118-r2","idempotency_key":"SCRUM-118-r2","owner_root":".task-me","artifacts":[{"path":".task-me/runs/scrum-118/task-package.json"}],"blockers":[],"dag_valid":true,"artifact_id":"task-me-result-r2","parent_artifact_id":null,"source_repo":"nhatnguyenquang1838-coder/gwc","source_ref":"main","source_sha":"e0031b01ea9ea4f72a1119a81d732bbaee2b4921","tool_package":"task-me@main-pinned","tool_source_commit":"187586fb124a2687fef70c1c4a3a3b8b2cd02b09","generated_at":"2026-07-28T00:35:00+07:00"}
